{
  "schemaVersion": 1,
  "builtFrom": {
    "factsThrough": "2026-10-22",
    "readingsThrough": null
  },
  "dateKey": "2026-10-30",
  "brief": {
    "stats": {
      "countriesCovered": 14,
      "sourceOutlets": 12,
      "totalArticles": 14
    },
    "summary": "A **$6.3 billion security breach at Binance** has shaken global cryptocurrency markets, with analysts calling it potentially the largest crypto heist in history. The incident underscores the persistent vulnerability of digital asset platforms even as institutional adoption grows, and it arrives amid a broader climate of instability spanning Europe, Asia, and the Horn of Africa. The breach's scale could trigger regulatory crackdowns and erode confidence in centralized exchanges at a critical moment for the sector.\n\nMeanwhile, **Europe is reeling from two major transport disasters**: a high-speed train collision in Spain's Toledo province that killed at least 69 people, and a Russian drone strike on a crowded Dnipro train station in Ukraine that killed at least 14. The Spanish crash has already become a political flashpoint ahead of snap elections, while the Dnipro attack marks a sharp escalation in Russia's air campaign against civilian infrastructure. Both events highlight the growing human cost of infrastructure failures and conflict in Europe.\n\nIn Asia, **China's record expulsion of Communist Party members** signals an intensification of Xi Jinping's anti-corruption purge, while North Korea's latest weapons demonstration—including attack drones and cruise missiles—underscores Pyongyang's push for 'absolute superiority.' The US and Japan's agreement to establish a joint missile production facility adds another layer to regional military posturing, suggesting a deepening arms-production alliance in the Indo-Pacific.\n\nThe European Central Bank faces leadership uncertainty as **Christine Lagarde steps down nine months early**, opening a succession race that could reshape monetary policy direction. In the Horn of Africa, Ethiopia's border clashes are driving thousands into Kenya, while El Niño-driven drought in Papua New Guinea affects up to 8 million people. These disparate crises reveal a world under simultaneous financial, military, climatic, and political stress, with **institutional resilience being tested on multiple continents**.",
    "risingThread": {
      "articleCount": 6,
      "dayCount": 3,
      "oneLiner": "The Toledo collision has become a national political crisis, with rail safety failures now central to Spain's snap election campaign and public trust in infrastructure eroding rapidly.",
      "threadId": "thread-spain-high-speed-train-collisi-e41c9f",
      "title": "Spain Train Crash Exposes Rail Safety Failures Before Election",
      "trajectory": "escalating"
    },
    "displayDate": "October 30, 2026",
    "headline": "Binance Suffers Record $6.3 Billion Breach as Global Crises Multiply",
    "dateKey": "2026-10-30",
    "topStories": [
      {
        "category": "technology",
        "iso3": [],
        "prediction": "Regulators in the US, EU, and Asia will announce coordinated investigations into exchange security practices within two weeks, and Binance will face significant customer withdrawals and legal challenges.",
        "regions": [
          "Global"
        ],
        "sourceCount": 3,
        "threadId": "thread-binance-security-breach-impact-fb5999",
        "title": "Binance Security Breach Impacts $6.3 Billion in Assets, Potentially Largest Crypto Heist"
      },
      {
        "category": "disaster",
        "iso3": [
          "ESP"
        ],
        "prediction": "The Spanish government will announce a national rail safety review and suspend high-speed services on the affected line within days, intensifying political pressure ahead of the snap election.",
        "regions": [
          "Spain"
        ],
        "sourceCount": 3,
        "threadId": "thread-spain-high-speed-train-collisi-e41c9f",
        "title": "Spain High-Speed Train Collision Kills 69 in Toledo Province"
      },
      {
        "category": "conflict",
        "iso3": [
          "UKR",
          "RUS"
        ],
        "prediction": "Ukraine will launch retaliatory strikes on Russian logistics hubs within 72 hours, and Western allies will issue fresh condemnations while accelerating air defense deliveries.",
        "regions": [
          "Ukraine",
          "Russia"
        ],
        "sourceCount": 3,
        "threadId": "thread-russian-drone-strike-on-dnipro-d64183",
        "title": "Russian Drone Strike on Dnipro Train Station Kills at Least 14"
      }
    ],
    "categoryBreakdown": {
      "climate": 1,
      "conflict": 3,
      "disaster": 3,
      "economy": 1,
      "military": 2,
      "politics": 4,
      "technology": 1
    },
    "countryToWatch": {
      "countryName": "Spain",
      "headline": "Spain faces a snap election amid a housing crisis and a rail disaster that has killed at least 69 people, fueling public anger and political instability.",
      "iso3": [
        "ESP"
      ],
      "riskLevel": "high",
      "threadId": "thread-spain-high-speed-train-collisi-e41c9f",
      "trajectory": "escalating"
    },
    "generatedAt": "2026-10-30T14:01:22.979Z",
    "model": "deepseek-v4-pro"
  }
}
